Steve Ciobo tells former terrorism suspect Zaky Mallah he’d be pleased to see him ‘out of the country’ – video,2015 jun 22
Laws targeting illegal downloads from overseas websites pass Senate,2015 jun 22
Greens senator Larissa Waters attacked after invoking Pope on climate change – as it happened,2015 jun 22
Kathy Jackson loses attempt to stop HSU civil case against her,2015 jun 22
Liberals 'disgusted' after Larissa Waters asks if Tony Abbott will listen to Pope on climate change – video,2015 jun 22
"Exclusive on Tuesday: Julia Gillard on politics, prime ministers and the media",2015 jun 22
There's more to transport than roads. What does this government have against trains?,2015 jun 22
We can save $300m in the PBS with rules we already have. So why don't we?,2015 jun 22
Tony Abbott praises ‘creative thinking’ on school funding – video,2015 jun 22
Tony Abbott rules out rich paying fees for public schooling,2015 jun 22
Australia and Indonesia's infantile posturing over refugees is sad and dangerous,2015 jun 22
"‘We won’t let you back’, Tony Abbott says of dual nationals fighting with ‘terrorist armies’ – video",2015 jun 22
Amber Heard says she and Johnny Depp will avoid Australia after threat to dogs – video,2015 jun 23
Tony Abbott confident Australian Isis fighter Mohamed Elomar killed in Iraq,2015 jun 23
Waleed Aly attacks Zaky Mallah on The Project for doing 'more damage than help' on Q&A – video,2015 jun 23
Renewables will supply majority of Australia's electricity by 2040 – study,2015 jun 23
GST debate fires up again with proposal to distribute on per-capita basis,2015 jun 23
Coalition defends proposed citizenship laws – as it happened,2015 jun 23
"Dual nationals involved in terrorism will have citizenship revoked, Abbott says",2015 jun 23
Are we being softened up for a slightly less horrendous education reform?,2015 jun 23
Turnbull orders ABC security review after ‘error of judgment’ over Zaky Mallah on Q&A – video,2015 jun 23
Gladys Berejiklian defends NSW stamp duty rate as it reaps record surplus,2015 jun 23
States blast leaked proposal for federal government to exit hospital funding,2015 jun 23
How Zaky Mallah ended up on live TV: Q&A producers took a calculated risk,2015 jun 23
Abbott asks the ABC 'whose side are you on?' over Zaky Mallah's Q&A appearance,2015 jun 23
'Whose side are you on?' Abbott asks ABC after Zaky Mallah appears on Q&A – video,2015 jun 23
Fuel tax rises on way after Labor and Coalition agree deal on road spending,2015 jun 23
Zaky Mallah: I stand by what I said on Q&A. Australia needs to hear it,2015 jun 23
"Killing Season: Labor's collapse was the worst I've ever seen, says British adviser",2015 jun 23
Julia Gillard exclusive interview: the timid ABC is rewarding Tony Abbott,2015 jun 23
"Julia Gillard book exclusive: how the bullying, biased media hurts Australia",2015 jun 23
Coalition backs away from revoking citizenship from terrorism suspects in Australia,2015 jun 23
ABC says allowing former terrorism suspect on Q&A was an 'error in judgment',2015 jun 23
Classified Asio documents shown on TV during Tony Abbott photo opportunity,2015 jun 24
It's a slippery slope if we enact laws based on fear rather than reason,2015 jun 24
Bipartisan report calls for recognition of Indigenous Australians in constitution,2015 jun 24
Foreign fighters need 'modern form of banishment' says Tony Abbott in Magna Carta lecture,2015 jun 24
Catholic church writes to companies that support same-sex marriage,2015 jun 24
Labor supports asylum bill but lambasts Coalition's partisan record on issue,2015 jun 24
Citizenship and last minute offshore processing bills dominate parliament – as it happened,2015 jun 24
Liberal party email invokes terrorism and citizenship laws to seek donations,2015 jun 24
Peter Greste says Q&A with Zaky Mallah 'didn't cross the line' to incitement,2015 jun 24
"The 'allegiance to Australia' bill: arguably unconstitutional, definitely questionable",2015 jun 24
Citizenship could be stripped for damaging commonwealth property,2015 jun 24
Children may lose Australian citizenship under proposed legislation,2015 jun 24
"Australia transfers asylum seeker baby to Nauru, despite warnings – reports",2015 jun 24
The hysteria over Zaky Mallah on Q&A would make Joseph McCarthy proud,2015 jun 24
Julie Bishop comments on applying citizenship changes retrospectively – video,2015 jun 24
Bill Shorten and the Australian Workers' Union – the allegations explained,2015 jun 24
10-flag announcement brings government flag count to all-time high,2015 jun 24
Coalition and Labor rush to legislate on high court threat to offshore detention regime,2015 jun 24
Through the Moon short film: the poets of Manus and Nauru – video,2015 jun 24
Politics as blood sport: The Killing Season makes the Blair-Brown rift look tame,2015 jun 24
Renewable energy target: Senate sits late to pass bill without amendment,2015 jun 24
Senate passes bill to protect offshore processing from high court challenge,2015 jun 25
Bjørn Lomborg university funding tied to 'rational conversation' lectures,2015 jun 25
Glenn Lazarus rises to head committee inquiring into Man Haron Monis letter,2015 jun 25
"Offshore processing bill passes as Coalition, Labor vote down limits   – as it happened",2015 jun 25
"Indigenous recognition will help redress discrimination, says Nova Peris",2015 jun 25
Senate shoots down divorce fee hikes over concerns about domestic violence,2015 jun 25
I became a post-materialist in Priceline. It's not as good as it sounds,2015 jun 25
Tony Abbott says 'heads should roll' at ABC after rebroadcast of Q&A,2015 jun 25
Customs officers' walkout at Melbourne airport 'counterproductive' – Eric Abetz,2015 jun 25
"Heads should roll at ABC after Q&A ‘betrayal’, says Tony Abbott – video",2015 jun 25
Bill Shorten seeks new chief of staff as Ken Macpherson plans to step down,2015 jun 25
Q&A is the symbol of High Kevinism and should be interred with Rudd's memory,2015 jun 25
Bill Shorten regrets making 'mistake' in dismissing Gillard-Rudd leadership talk,2015 jun 25
Means test welfare but not education. That's privatisation by stealth,2015 jun 25
Whistleblowers could have citizenship revoked under proposed laws,2015 jun 25
Legal challenge to Australia's offshore detention of asylum seekers goes ahead,2015 jun 26
Industry superannuation funds facing government overhaul lobby senators,2015 jun 26
Bill Shorten's crisis of confidence: how poll frontrunner became hollow man,2015 jun 26
ABC security boosted after threats over Zaky Mallah's Q&A appearance,2015 jun 26
Travel delays expected across Australia after customs announce strike plans,2015 jun 26
"Abbott has given up on debt and deficit reduction, but few have noticed",2015 jun 26
Mike Baird's Muslim engagement could work where Tony Abbott is failing,2015 jun 26
Australian citizenship: What does it mean to you?,2015 jun 26
Scott Morrison confronted by disability support protester – video,2015 jun 26
Mike Baird shows Tony Abbott what inclusive leadership is all about,2015 jun 26
"The Q&A scandal is very, very serious. We know because we've been told so",2015 jun 26
"Liberals roll out ad attacking Shorten, but insist there will be no early election",2015 jun 27
"Gay marriage back on Australian agenda after US ruling, says Christopher Pyne",2015 jun 27
"Labor's policy on stopping the boats is 'all over the shop', says Peter Dutton – video",2015 jun 28
Senior Liberal MP pulls out of Q&A appearance over Zaky Mallah affair,2015 jun 28
"Australian climate policy paralysis has to end, business roundtable says",2015 jun 28
#sosblakaustralia protests: Share your photos and stories,2015 jun 28
"Stripping citizenship from sole nationals would face legal problems, expert says",2015 jun 28
"Sophie Mirabella wins preselection for Indi, but will face Nationals challenge",2015 jun 28
Turnbull says US court decision will add to momentum for same-sex marriage,2015 jun 28
Bill Shorten: Liberal smear campaign a sure sign of approaching election,2015 jun 28
Joel Fitzgibbon: Labor should consider adopting asylum boat turnbacks policy,2015 jun 28
"Q&A aftermath: 'You've lost the plot, Barrie' says Malcolm Turnbull – video",2015 jun 28
Malcolm Turnbull flags formal proposals for ABC changes during fiery interview,2015 jun 28
"Gay marriage ruling ‘a matter for the United States', says Tony Abbott – video",2015 jun 28
Developing the North: Indigenous advocates call for forum to air views,2015 jun 28
"Isis coming for us, says Tony Abbott after Tunisia, France, Kuwait attacks – video",2015 jun 28
"Coalition loses ground to Labor in five main states, poll analysis shows",2015 jun 29
Q&A host Tony Jones says ABC team was not aware of Zaky Mallah's misogynistic tweet – video,2015 jun 29
Time to tell the truth before I'm gagged: Australia's detention centres ruin lives,2015 jun 29
"ABC's Tony Jones walks the tightrope, with Q&A spotlight directly on itself",2015 jun 29
Detention doctors and nurses rally in opposition to asylum seeker disclosure laws,2015 jun 29
Q&A returns after Zaky Mallah controversy – as it happened,2015 jun 29
"Liberal party boycott of Q&A would be petulant groupthink, says backbencher",2015 jun 29
Julie Bishop: Australia will use private firms like Coca-Cola to deliver aid,2015 jun 29
Marty Natalegawa worries Canberra-Jakarta relationship strained,2015 jun 29
Greens move on Senate voting reform would lock out micro parties,2015 jun 29
"Newman government acted 'like the KGB' in mine bid, say traditional owners",2015 jun 29
Malcolm Turnbull says there is 'no boycott' of Q&A – video,2015 jun 29
Labor left tries to head off damaging split on boat turnbacks policy,2015 jun 29
Fairbridge Farm students receive record $24m payout for 'sickening' child abuse,2015 jun 29
Josh Frydenberg's industry super change is either pointless politics or vandalism,2015 jun 29
"Q&A loses second guest, Nick Cater, following Zaky Mallah controversy",2015 jun 29
"For Aboriginal people, just staying alive is the priority, says Mick Gooda",2015 jun 29
"Same-sex marriage 'should not be a party political issue', says Bill Shorten – video",2015 jun 29
Does Australia have a workable climate change policy? – podcast,2015 jun 29
Australia's free trade pact with China won't feel like freedom for workers,2015 jun 30
Tribunal refuses to release Abbott government's university fee modelling,2015 jun 30
Detention centre staff speak out in defiance of new asylum secrecy laws,2015 jun 30
Government laments 'disappointing' fall in breast cancer screening rate,2015 jun 30
Australian Jewry says aspects of anti-terrorist laws 'manifestly inadequate',2015 jun 30
Joe Hockey's defamation crown sits a little askew,2015 jun 30
Nauru plan to move asylum seeker children to local schools sparks concern,2015 jun 30
Labor to debate raising affirmative action quotas for women to 50%,2015 jun 30
"Same-sex marriage a god-given right not a gift from government, says US ambassador – video",2015 jun 30
"Joe Hockey wins $200,000 from Fairfax in 'Treasurer for sale' defamation case",2015 jun 30
"Federal funding cuts in health will have 'devastating' impact, say states",2015 jun 30
Bill Shorten: demonising disaffected Muslim youths will not stop radicalisation – video,2015 jun 30
Bill Shorten backs political donation reform after reports of mafia links,2015 jun 30
"NSW police in talks to repatriate Khaled Sharrouf's family, says lawyer",2015 jun 30
Greg Hunt hasn't a lot to show for $660m spent on reducing greenhouse emissions,2015 may 01
Julie Bishop defends appointment of Bjørn Lomborg to foreign aid group,2015 may 01
"If the trade union royal commission investigates Labor, it's in murky territory",2015 may 01
Australian aid helps keep Indonesia's legal system transparent. So why cut it?,2015 may 01
Foreign investors face crackdown on Australian property purchases,2015 may 02
Christopher Pyne lays claim to Hecs payments from Australians overseas,2015 may 02
Federal government allocates $1.6m to steer vulnerable away from extremism,2015 may 02
Economists expect Reserve Bank to cut interest rate to record low of 2%,2015 may 02
Budget 2015: Bill Shorten says Australia 'can't afford a dull budget or an ordinary effort',2015 may 03
"Australia's budget deficits to blow out by $47bn over four years, modelling shows",2015 may 03
Labor leadership divides over compulsory same-sex marriage yes vote,2015 may 03
Coalition reveals details of its childcare assistance package ahead of budget,2015 may 03
Brisbane protest over Indigenous community closures occupies City Hall,2015 may 03
Tony Abbott hails birth of royal baby as a 'great day for Australians',2015 may 03
"Government to spend $200,000 a year on Kirribilli House gardens, figures show",2015 may 03
"Tony Abbott draws level with Bill Shorten as preferred PM, poll shows",2015 may 04
"Charities watchdog receives about 12 complaints each week, report shows",2015 may 04
Pharmacy Guild threatens campaign over $1 discount that could save $400m,2015 may 04
Clive Palmer wins legal battle against Chinese mining partner,2015 may 04
Queensland Labor says LNP will have to reveal its secret donors,2015 may 04
"Coalition may soften on renewable energy as Labor to consider 33,000 GWh target",2015 may 04
Memes and listicles for all: the 2015 budget is going viral,2015 may 04
Australia has some brilliant arts minds – it's time we backed them,2015 may 04
"We don't want to see WA Indigenous people have the struggle we've had, Melbourne protesters say - video",2015 may 04
Tony Abbott says 2015 budget will 'show steady progress in the right direction',2015 may 04
"Stopping boats and closing detention centres will save $504m, says Tony Abbott",2015 may 04
WA's fight for GST revenue: Tony Abbott to give state $500m for road projects,2015 may 05
Tax changes will allow startups to write off investment costs immediately,2015 may 05
Australian envoy to France 'resigned after defying ruling on gay partner',2015 may 05
Renewable energy target deadlock set to give way to compromise deal,2015 may 05
"Interest rate cut justifies not reining in super tax concessions, Joe Hockey says",2015 may 05
Reserve Bank of Australia: RBA cuts interest rates to 2% – as it happened,2015 may 05
"Australia returned 46 asylum seekers to Vietnam, says immigration minister",2015 may 05
Reserve Bank of Australia cuts rates to historic new low of 2%,2015 may 05
Australian CEOs call on political leaders to support marriage equality,2015 may 05
"Once more, with feeling – Tony Abbott tries again with second budget",2015 may 05
Most groups funded under Indigenous advancement strategy non-Indigenous,2015 may 05
Carrie Bickmore tells how Christopher Pyne helped her through her labour – video,2015 may 05
"Part-pension eligibility to be tightened in budget, Scott Morrison indicates",2015 may 05
"Under Richard Di Natale, Greens have an opportunity to work with the Coalition",2015 may 06
"Budget 2015: pensions overhaul will stop payments to 90,000 recipients",2015 may 06
"Restricting childcare benefit would hit poorest children hard, researchers warn",2015 may 06
Indigenous legal services peak body wins last-minute pre-budget reprieve,2015 may 06
"Richard Di Natale has yet to make a splash, but Shorten and Abbott should worry",2015 may 06
"With Christine Milne gone, it's wall-to-wall blue ties in Canberra",2015 may 06
Richard Di Natale elected unopposed as new Greens leader after Christine Milne resigns – as it happened,2015 may 06
Richard Di Natale sets Greens' agenda after replacing Christine Milne,2015 may 06
Tony Abbott dismisses reports of ambassador offering to resign as 'trivia',2015 may 06
"Christine Milne has resigned the Greens leadership. Oh, the humanity!",2015 may 06
Lenore Taylor's fantasy budget cabinet – podcast,2015 may 06
Christine Milne: her journey from Tasmanian 'farm girl' to Greens leader,2015 may 06
Richard Di Natale: 21st century issues are Greens issues – video,2015 may 06
"Richard Di Natale elected as Greens leader, says Rachel Siewert – video",2015 may 06
Bob Brown says Christine Milne's departure as leader of the Australian Greens came as a surprise – video,2015 may 06
Christine Milne resigns as Greens leader and will not recontest Senate seat,2015 may 06
Have your say: you balance the 2015 Australian budget - interactive,2015 may 07
"Government asked for asylum mental health data to be cut, documents show",2015 may 07
Australian budget 2015: researchers relieved at two-year funding extension,2015 may 07
Christine Milne defends Greens' leadership election process,2015 may 07
Sex party to 'vigorously' appeal against Electoral Commission deregistration,2015 may 07
Morrison's pension reform is tinkering at the edges. There is another solution,2015 may 07
Will Joe Hockey use the 2015 budget to stimulate a stalling economy?,2015 may 07
Budget 2015: GST on the cards for overseas internet downloads,2015 may 07
NSW Greens see blue skies ahead after Christine Milne's resignation,2015 may 07
Australian workforce sheds more jobs than expected in blow for Joe Hockey,2015 may 07
"Nauru detention centre should have an independent monitor, UN inspectors say",2015 may 07
Indigenous rangers call for expansion of 'world-leading' jobs scheme,2015 may 07
Peter Dutton announces imminent transfer of refugees from Nauru to Cambodia – video,2015 may 07
Push to change welfare indexation after survey reveals extent of housing stress,2015 may 08
Abbott government hands extra $83m for drought-affected regions,2015 may 08
Coalition's unwillingness to tax means commitment to fairness won’t last,2015 may 08
Tiwi Islands port developer ordered to have project environmentally assessed,2015 may 08
"After Shorten's shabby Milne send-off, can Labor's Greens resentment end?",2015 may 08
Richard Di Natale answers Lenore Taylor's quick-fire questions – video,2015 may 08
"How Joe Hockey's disastrous first budget fell apart, brick by brick",2015 may 08
Australia's renewable energy target deal hits last-minute snag over wood burning,2015 may 08
"Budget childcare package includes extra $328m for needy, says Scott Morrison",2015 may 08
It's been a year of rupture in Indigenous affairs. Time to show some solidarity,2015 may 08
Former Fraser government minister Michael MacKellar dies aged 76,2015 may 09
New-generation cancer drugs to be subsidised under $1.3bn budget promise,2015 may 09
Edward Snowden says Australia’s new data retention laws are 'dangerous',2015 may 09
Barnaby Joyce tells Andrew Bolt that UWA's Bjørn Lomborg decision down to 'consultancy fees' – video,2015 may 10
Sophie Mirabella to seek Liberal preselection for Victorian seat of Indi,2015 may 10
Mathias Cormann refuses to put figure on public service job cuts in budget,2015 may 10
Nationals senators to oppose cutting benefits to pay for childcare package,2015 may 10
Barnaby Joyce suggests hostility to Bjørn Lomborg's centre money-based,2015 may 10
"Renting should top housing affordability policy, Senate committee says",2015 may 10
Coalition's childcare package gives bigger handouts to all working parents,2015 may 10
Budget 2015: Labor slams Hockey’s crackdown on multinational tax avoidance as a 'thought bubble’ – video,2015 may 11
Budget 2015: government allocates $450m for security and counter-terrorism,2015 may 11
Norfolk Islanders make appeal to federal MPs not to abolish island's parliament,2015 may 11
Joe Hockey can't say how much tax avoidance crackdown will raise – video,2015 may 11
Budget 2015: Joe Hockey announces measures on tax avoidance and downloads – politics live,2015 may 11
Nick McKim to nominate for Greens in Christine Milne's vacant Senate seat,2015 may 11
Budget 2015 to include 'Netflix tax' and greater powers to deal with avoidance,2015 may 11
"Public service job cuts would break promise to the ACT, says chief minister",2015 may 11
Budget 2015: devil is in the detail but it's all rather blurry,2015 may 11
"Universities 'censor' bad ideas all the time, Tim Wilson. It's called learning",2015 may 11
"Budget 2015 must recognise benefits of stay-at-home parenting, Nationals say – video",2015 may 11
Ending double dipping on parental leave unlikely to save money – business group,2015 may 11
Budget 2015: Tony Abbott says 'let's talk' about how to pay for childcare policy,2015 may 11
"Budget 2015: Labor senator says it will focus on Coalition ideology, not fairness – video",2015 may 11
Australia Post hands $51m lifeline to ailing rural and remote post offices,2015 may 12
Budget 2015: who are Australia's winners and losers?,2015 may 12
Budget 2015: opposition parties and interest groups react – as it happened,2015 may 12
Joe Hockey's second budget: the Guardian Australia team's analysis - video,2015 may 12
Christmas Island detention centres to close as part of immigration savings,2015 may 12
Budget 2015: $2bn for Indigenous housing and investment in remote areas,2015 may 12
Farmers get tax discounts in budget for drought preparedness assistance,2015 may 12
Budget cuts $1.8bn from health to pay  for medical research fund and PBS drugs,2015 may 12
Australian budget hands emissions reduction fund another year of funding,2015 may 12
The budget to repair the (poll) damage  done by the last budget – in graphs,2015 may 12
"Youth payments widened in budget, but family tax benefit cuts go ahead",2015 may 12
The 2015 budget confirms the Abbott government will never pay off its debt,2015 may 12
Budget’s education ‘fix’: cuts to research to pay for lifeline to landmark scheme,2015 may 12
Joe Hockey says the government ‘listened and learned’ on unemployment benefits – video,2015 may 12
Budget 2015: full breakdown of revenue and expenditure,2015 may 12
Budget confirms 30 multinationals face tax avoidance crackdown,2015 may 12
Budget 2015: extra $1.2bn for security measures to ‘keep Australia safe’,2015 may 12
Budget savings hit surprising targets: backpackers and fly-in-fly-out workers,2015 may 12
"Australia cuts aid to Indonesia by 40%, federal budget reveals",2015 may 12
Joe Hockey’s 2015 budget speech  annotated: ‘Please forget last year’,2015 may 12
Budget 2015: key points from Joe Hockey’s announcements,2015 may 12
Big-spending Joe Hockey delivers a federal budget that will please no one,2015 may 12
Confused budget reveals Joe Hockey's real agenda: political survival,2015 may 12
Joe Hockey says timetable to budget surplus is on track – video,2015 may 12
Part-pension changes in budget will affect hundreds of thousands of people,2015 may 12
Find out exactly how your tax dollars will be spent – budget interactive,2015 may 12
Budget plan to limit unemployment benefits for under-30s scrapped,2015 may 12
Federal budget: tax cuts for small  business as part of $5bn package,2015 may 12
Joe Hockey says budget gives small business 'chance to have a go' – video,2015 may 12
Budget 2015: Joe Hockey’s giveaway targets small business and parents,2015 may 12
Budget 2015: the day in parliament – as it happened,2015 may 12
Budget 2015: Coalition u-turn on young jobseekers' six-month wait for dole,2015 may 12
"Budget 2015: no new cuts to foreign aid, says Julie Bishop",2015 may 12
Palmer United party declares it will not field candidates in state elections,2015 may 12
"Bjørn Lomborg centre earmarked for UWA in 'corrupt process', says Labor MP",2015 may 12
Norfolk Island loses its parliament as Canberra takes control,2015 may 12
Renewable energy target still in limbo after Labor rejects biennial reviews,2015 may 12
Joe Hockey says budget deficit will beat expectations to come in below $40bn,2015 may 12
Budget 2015: Joe Hockey press conference interrupted for selfie – video,2015 may 12
"Budget 2015: cut foreign aid to fund childcare, says Jacqui Lambie – video",2015 may 12
Johnny Depp's dogs must 'bugger off' to US or face death for entering Australia,2015 may 13
"Barnaby Joyce threatens to put down Johnny Depp's dogs, allegedly brought into Australia illegally – video",2015 may 13
Former PUP senator Glenn Lazarus to start his own political party,2015 may 13
Federal budget 2015: jobseeker penalty increases to cost more than savings,2015 may 13
"Carol Mills was paid $380,000 after losing parliamentary services job",2015 may 13
Arthur Sinodinos tells Liberals it's 'not a good look having a go at young mothers',2015 may 13
Crossbench senators issue ultimatum over plan to curb micro-party influence,2015 may 13
Christmas Island detention centres may be used as tourist accommodation,2015 may 13
After the budget: shh! Australia's era of artistic silencing begins,2015 may 13
"Joe Hockey 'playing Scrooge' with foreign aid cuts, says Save the Children",2015 may 13
"Budget 2015: Tony Abbott creates new attack line, ruling out tax increases",2015 may 13
Budget 2015: Abbott sells the new vision as Labor criticises parental leave cuts – as it happened,2015 may 13
Remote Indigenous communities could close if NT government takes full control,2015 may 13
Budget takes $100m from Australia Council to establish arts excellence program,2015 may 13
Senator Cory Bernardi wins inquiry into halal and kosher certifications,2015 may 13
Chickens and citizens – some budget bits and bobs you may have missed,2015 may 13
Anyone suspected of having Ebola would face quarantine or jail under new powers,2015 may 13
GuardianWitness: How will Australia's 2015 budget affect you?,2015 may 13
Labor will oppose federal budget paid parental leave changes - video,2015 may 13
"Joe Hockey’s budget a 'smokescreen', says Bill Shorten in reply speech – video",2015 may 14
States contradict Joe Hockey pledge on concessions for former part-pensioners,2015 may 14
"Labor vows to write off 100,000 Hecs student loans as Coalition disputes cost",2015 may 14
Bill Shorten decries budget 'hoax' in reply speech – as it happened,2015 may 14
