Northern Territory chief minister Adam Giles vows to boost Indigenous jobs,2015 aug 01
"Andrew Wilkie calls for fraud inquiry into Bishop's $6,000 plane trip",2015 aug 01
Coalition MPs demand proper say on next Speaker as Bronwyn Bishop quits,2015 aug 02
Bronwyn Bishop resigns as Speaker – as it happened,2015 aug 02
Bronwyn Bishop travel expenses scandal: how it unfolded – timeline,2015 aug 02
Bronwyn Bishop had to be forced out – but some good may come of the scandal,2015 aug 02
"Bronwyn Bishop resigns as Speaker, Tony Abbott announces",2015 aug 02
Nova Peris says government language around Indigenous people is patronising,2015 aug 02
Bronwyn Bishop: formidable political warrior who walked a rocky road,2015 aug 02
Manus Island: rejected asylum seekers to be deported by Papua New Guinea,2015 aug 02
"Bronwyn Bishop splashed $1,000 on limousines in one day, reports say",2015 aug 02
Galarrwuy Yunupingu presented with honorary doctorate at Garma festival,2015 aug 02
"University fee deregulation: Coalition's $20,000 fight to keep modelling secret",2015 aug 03
Proposal to strip citizenship criticised by human rights groups and legal experts,2015 aug 03
"Bjørn Lomborg consensus centre may have had up to $800,000 in public funds for marketing",2015 aug 03
Senate inquiry recommends national standards on windfarm noise levels,2015 aug 03
Politicians’ expenses post-Bronwyn Bishop: four reforms gaining traction,2015 aug 03
Tony Abbott rejects proposal to hold Indigenous conventions on recognition,2015 aug 03
Tony Abbott denies Bronwyn Bishop offered inducements to quit as Speaker,2015 aug 03
Alive and kicking: Australia's animal export trade booms despite persistent claims of cruelty,2015 aug 03
Wallets out for Bronny: Twitter reacts to Speaker's resignation with hashtag,2015 aug 03
A presentation on Bronwyn Bishop's legacy from Fiona the Unemployed Bettong,2015 aug 03
Greg Hunt urged to scrap Carmichael mine plan after new evidence of impact,2015 aug 03
"Bronwyn Bishop's problems 'created by errors of judgment', says Malcolm Turnbull – video",2015 aug 03
Bronwyn Bishop says her chief of staff would be a good successor in Mackellar,2015 aug 03
Public servants deny 'ducking for cover' over mishandling of Sydney siege letter,2015 aug 03
"Australia's leaders 'wilfully blind' about climate change, says former NAB chief",2015 aug 03
Let this conversation over Adam Goodes inspire us to push for a final settlement,2015 aug 03
"A letter to my patient, whose terminal cancer is the least of her worries",2015 aug 03
Prince of the outback: the story of the micronation of Hutt River - video,2015 aug 04
Why raising the Medicare levy is much fairer than hiking GST,2015 aug 04
Innocent Australians risk getting caught up in laws to strip citizenship – expert,2015 aug 04
Labor's Tony Burke made two free trips to China with lobby firm last year,2015 aug 04
"Voters still prefer Malcolm Turnbull over Tony Abbott as leader, poll shows",2015 aug 04
Tony Abbott pledges to bring forward shipbuilding projects to safeguard jobs,2015 aug 04
Tony Abbott's South Australia problem: on the front line of the Coalition's war to win back votes,2015 aug 04
"Productivity Commission's proposals are worse than WorkChoices, unions say",2015 aug 04
Workplace bullying whistleblowers shouldn't fear press hatchet jobs,2015 aug 04
Barnaby Joyce says falling coal profits could scupper Shenhua's NSW mine,2015 aug 04
Tony Abbott says he will pay a personal price for backing Bronwyn Bishop,2015 aug 04
Julie Bishop hails 'candid' talks with Indonesian counterpart Retno Marsudi,2015 aug 05
Julia Gillard apologises for 'very hurtful' claims about Nick Xenophon in memoir,2015 aug 05
"Future of Carmichael mine hinges not on skinks or snakes, but its business case",2015 aug 05
"Voters are 'gaming' pre-election polls leading to wild results, Mark Textor says",2015 aug 05
"'Punitive' plan to withhold dole will hurt domestic violence victims, inquiry told",2015 aug 05
Coalition will take six to eight weeks to revise its Carmichael coalmine approval,2015 aug 05
Trade minister Andrew Robb accuses Alan Jones of racism in radio interview – audio,2015 aug 05
"Gillian Triggs condemns bill to strip dual nationals' citizenship as 'broad, vague'",2015 aug 05
Approval for Adani's Carmichael coalmine overturned by federal court,2015 aug 05
"ABC moves Q&A to news division, but not until the end of the year",2015 aug 06
Joe Hockey rules out GST rise to fund states' expenditure,2015 aug 06
"Tony Abbott says MPs' party fundraiser expenses claims fair, but urges prudence",2015 aug 06
Coalition may change environment laws after Carmichael mine setback,2015 aug 06
Tony Abbott defends politicians' use of taxpayers' money – video,2015 aug 06
"Tony Abbott can brush off 'crises' like Cameron did, says Lynton Crosby",2015 aug 06
"Jobless rate jumps to 6.3% despite number of employed rising by 38,500",2015 aug 06
Australia turned back 20 asylum seeker boats with 633 people in past 18 months,2015 aug 06
Penalty rates: Tony Abbott backs hospitality employers' push for cuts,2015 aug 06
"Australia was ready to act on climate 25 years ago, so what happened next?",2015 aug 06
"Hey Tony Abbott, your strategy Spanx are showing",2015 aug 07
Brendan Nelson and Harry Jenkins to help lead entitlements review,2015 aug 07
"Coal is not the answer to India's energy poverty, whatever Tony Abbott says",2015 aug 07
"Coalition paying $150,000 to outsource higher education negotiations",2015 aug 07
Politicians’ entitlements and expenses: help investigate four years of data,2015 aug 07
Josh Frydenberg to appear on Monday's Q&A after Tony Abbott lifts ban,2015 aug 07
Labor takes fight against 'divorce tax' to the federal court,2015 aug 07
Abbott warns against courts 'sabotaging' projects such as Carmichael coalmine,2015 aug 07
Maritime union says protests will continue over sacking of workers by text,2015 aug 08
Joe Hockey orders sale of six residential properties owned by foreign nationals,2015 aug 08
Christopher Pyne and Tony Burke's travel scrutinised as review team named,2015 aug 08
Tony Smith chosen as new Speaker of the House of Representatives,2015 aug 09
Coalition slumps to five-month low in polls following expenses scandals,2015 aug 09
"Australians fear Coalition is not taking climate change seriously, poll shows",2015 aug 09
Tony Abbott refuses to name his preferred candidate for Speaker,2015 aug 09
Gay footballer Jason Ball to challenge safe Liberal seat of Higgins,2015 aug 09
Hugo Weaving stars in #WeCanDoThis marriage equality campaign,2015 aug 09
Tony Abbott on travel expenses: go by what would be acceptable in business,2015 aug 09
Josh Frydenberg on Q&A: entitlements changes 'shouldn't be unreasonable',2015 aug 10
Abbott government's 2030 emissions target dubbed 'pathetically inadequate',2015 aug 10
Coalition says citizenship bill will stand up to legal challenge but won't say how,2015 aug 10
Jason Ball says the Greens are 'in with a chance' against Liberal Kelly O’Dwyer,2015 aug 10
'Scary' carbon policy: three things to remember when the debate gets crazy,2015 aug 10
Tony Smith elected Speaker and Don Randall remembered – politics live,2015 aug 10
Cory Bernardi claimed expenses on day he spoke at anti-abortion fundraiser,2015 aug 10
Jacqui Lambie reveals 21-year-old son's ice addiction during welfare debate,2015 aug 10
Coalition’s emissions modelling shows little difference in economic impact of large or small cuts,2015 aug 10
Bronwyn Bishop reimagined as scandal-prone mother in Arrested Development parody – video,2015 aug 10
Look past the statistical comedy – the jobs figures are actually great news,2015 aug 10
Rainbow lights greet MPs at Canberra airport ahead of same-sex marriage bill,2015 aug 10
Crossbenchers insist Tony Abbott's 'feral' Senate is simply doing its job,2015 aug 10
Is the Senate feral? Independent senators give their views – video,2015 aug 10
Exclusive: Coalition modelling shows 2030 target will hit coal sector hardest,2015 aug 11
Same-sex marriage: disappointment and anger as Coalition party room rejects free vote,2015 aug 11
Same-sex marriage: Coalition party room sticks with the status quo – politics live,2015 aug 11
Confusing outcome shows Coalition's same-sex marriage troubles are not over,2015 aug 11
Senate strikes down Coalition's 'divorce tax' for second time in two months,2015 aug 11
Coalition refuses order to release details of $1.6bn 13.4km Perth freight link,2015 aug 11
Tony Abbott: government will not 'put the environment ahead of the economy' – video,2015 aug 11
Tony Abbott defends 2030 emissions target criticised as 'pathetically' low,2015 aug 11
Same-sex marriage: Coalition calls special joint party room meeting,2015 aug 11
Same-sex marriage raised in Liberal party room but free vote issue deferred,2015 aug 11
Australia could meet tougher emissions target 'with no extra economic pain',2015 aug 11
Jacqui Lambie pushes bill to let parents admit drug-addicted children to detox,2015 aug 11
Enough lip service. We need urgent action to prevent deaths of women and children,2015 aug 11
George Brandis tells Penny Wong she is 'becoming hysterical' and needs to calm down – video,2015 aug 11
"Emissions target: lack of detailed policy a major concern, say business leaders",2015 aug 12
Same-sex marriage and emissions target debates dominate parliament – politics live,2015 aug 12
Same-sex marriage: Tony Abbott wears Liberals' anger over free vote failure,2015 aug 12
Coalition's $20bn medical research future fund cleared by Senate,2015 aug 12
"A plebiscite on issues including same-sex marriage, tax reform, jeggings",2015 aug 12
"Don't tell gay men what they want, Labor MP Tim Watts tells Eric Abetz – video",2015 aug 12
Peter Dutton overturns deportation order for Vietnam war veteran,2015 aug 12
Bill Shorten: plebiscite decision 'a strategy to delay marriage equality' – video,2015 aug 12
Turnbull says plebiscite on gay marriage will overshadow Coalition's messages,2015 aug 12
RSL lobbies Peter Dutton to stop deportation of Vietnam war veteran,2015 aug 12
Seafood's country of origin will remain a mystery after Senate rejects bill,2015 aug 12
Same-sex marriage: Warren Entsch urges Tony Abbott to allow public vote on election day,2015 aug 12
Tony Abbott on same-sex marriage: 'Do not underestimate the magnitude of this' – video,2015 aug 12
Same-sex marriage: Pyne joins Brandis in shooting down referendum proposal,2015 aug 13
Nauru detention centre guards joked about shooting detainees before riot,2015 aug 13
Maritime union wins temporary order against sacking of Hutchinson workers,2015 aug 13
Emissions reduction fund: Shorten says Labor government would scrap scheme,2015 aug 13
Labor's state treasurers pledge to support removal of GST on tampons,2015 aug 13
There's no sensible reason to charge GST on tampons. Nor to raise the rate,2015 aug 13
Labor probes Dyson Heydon link to Liberal fundraiser – as it happened,2015 aug 13
Plan to delay dole for young jobseekers unlikely to pass Senate,2015 aug 13
Tony Abbott digs in to defend Dyson Heydon over Liberal party fundraiser,2015 aug 13
Cracks appear in cabinet as same-sex marriage splits Abbott's frontbench,2015 aug 13
Same-sex marriage: George Brandis slaps down Scott Morrison's call for a referendum,2015 aug 13
Penny Wong: same-sex marriage plebiscite could give 'green light to hate speech' – video,2015 aug 13
Labor party's divorce fees challenge rejected by federal court,2015 aug 13
Dyson Heydon's Liberal fundraiser booking sparks calls to close trade union commission,2015 aug 13
Warren Entsch warns PM not to 'play silly buggers' on same-sex marriage vote,2015 aug 13
"Australia should join fight against Isis and bomb Syria, says Liberal MP",2015 aug 13
Australia's national security should be above politics but not beyond scrutiny,2015 aug 14
Coalition a victim of its own trickiness as colleagues lose faith in Tony Abbott,2015 aug 14
Refugees forced to choose between PNG resettlement or 'custody in new prison',2015 aug 14
Cabinet ministers engage in open warfare on same-sex marriage,2015 aug 14
"Bernie Fraser contradicts PM, saying emissions target puts Australia 'near the bottom' globally",2015 aug 14
Expenses rorts point to the widespread rot in Australia's democracy,2015 aug 14
Greens call for Wilson Security ban at Nauru amid claims of spying on senator,2015 aug 14
Six months of Labor: popular Palaszczuk keeps Queensland show on the road,2015 aug 14
"Whistleblowers expose alleged abuse of asylum seekers on Nauru, defying Border Force Act – video",2015 aug 14
Tony Abbott says Liberal party must become less 'blokey' but rules out quota,2015 aug 15
Tony Abbott welcomes Shinzo Abe’s second world war 'remorse',2015 aug 15
Climate Change Authority head says Coalition's $600bn carbon bill claim 'weird',2015 aug 15
Same-sex marriage: Warren Entsch's bill set for scrapheap as Liberals squabble,2015 aug 16
"Tony Abbott is a climate change 'villain', says Canadian author Naomi Klein",2015 aug 16
"Coalition facing huge election defeat after horror weeks, latest poll shows",2015 aug 16
Labor asks PM to reveal Dyson Heydon's payment for heading trade union inquiry,2015 aug 16
Young soldier aims to fill the late Liberal Don Randall's shoes in WA byelection,2015 aug 16
Apple and Google may have to show tax paid in Australia under Senate proposal,2015 aug 16
'Dob in a dealer': Tony Abbott announces hotline to combat ice,2015 aug 16
Tony Abbott denies claim asylum seekers are being waterboarded on Nauru,2015 aug 16
Former Wallabies player Bill Calcraft eyes Bronwyn Bishop’s Sydney seat,2015 aug 16
ACTU considers taking Dyson Heydon to the high court,2015 aug 16
Tony Abbott rules out same-sex marriage vote on election day,2015 aug 16
Senate rejection of union oversight bill sets up potential double dissolution trigger,2015 aug 17
"Coalition at risk of losing Canning byelection, poll shows",2015 aug 17
"Q&A: discrimination on same-sex marriage cuts both ways, panel says",2015 aug 17
George Brandis urged to respect rule of law by former Liberal attorney general,2015 aug 17
Push to bring back ABCC building industry watchdog blocked by Senate,2015 aug 17
NRMA accuses taxi lobby of self-interest after complaint to ACCC over UberX,2015 aug 17
Abbott's small government: cabinet meets without single formal submission to debate,2015 aug 17
Warren Entsch 'lives in hope' his marriage equality bill will succeed eventually  – as it happened,2015 aug 17
"Dyson Heydon 'overlooked' Liberal link, but gave commission witnesses less leeway",2015 aug 17
When's a political fundraiser not a fundraiser? When it doesn't raise much,2015 aug 17
George Brandis: vigilante green groups destroying thousands of mining jobs,2015 aug 17
Dyson Heydon 'overlooked' link between event organisers and Liberals,2015 aug 17
"Tony Abbott ‘doing everything to try and stop marriage equality’, says Labor MP – video",2015 aug 17
"Tony Abbott, the 'lonely nihilist', has one last lesson for us",2015 aug 17
Don Randall's Canning byelection date set for 19 September,2015 aug 17
Transfield defends evidence given at Senate inquiry into Nauru abuse,2015 aug 17
Same-sex marriage: Tony Abbott keeps referendum option open,2015 aug 17
Josh Frydenberg says Coalition will not name and shame corporate tax dodgers,2015 aug 17
Indigenous leaders to meet Tony Abbott over constitutional recognition,2015 aug 18
Philip Ruddock questions move to stop green groups challenging mine plans,2015 aug 18
Nauru guard who ordered spying on Sarah Hanson-Young to face inquiry,2015 aug 18
Tony Abbott urges discipline amid pressure over Dyson Heydon and same-sex marriage – as it happened,2015 aug 18
Labor to ask governor general to close union inquiry over Dyson Heydon row,2015 aug 18
Abbott government war on green 'saboteurs' is Laurel and Hardy slapstick,2015 aug 18
Coalition to restrict green groups' right to challenge after Carmichael setback,2015 aug 18
"Spiked editor on same-sex marriage: 'Hey you stupid Christians, make this cake' – video",2015 aug 18
Glitter in GetUp’s letter to Liberal MP mistaken for suspicious powder,2015 aug 18
Tony Abbott warns ministers they will face consequences if caught leaking,2015 aug 18
Bill Shorten is no longer Labor's 'tired accountant'. He deserves to lead them to victory,2015 aug 18
"Anti-halal 'hate campaigns' damaging $13bn Australian industry, say certifiers",2015 aug 18
Farm groups furious at Coalition move to restrict environmental challenges,2015 aug 19
Julie Bishop says Labor's claims over China trade deal are 'economic treason',2015 aug 19
The Weekly Beast: did Kerry Packer hack Paul Keating?,2015 aug 19
"Labor press government on Dyson Heydon, free trade agreement  – as it happened",2015 aug 19
Is Joe Hockey going to bust some monopolies? His IP referral gives us hope,2015 aug 19
Leaked talking points detail how to handle questions on cabinet leaks,2015 aug 19
Unions push on with attempt to get Dyson Heydon to disqualify himself,2015 aug 19
Labor party 'will consider' cashless welfare debit cards legislation,2015 aug 19
Eric Abetz says cabinet colleagues who leak to media are 'gutless',2015 aug 19
"Domestic violence leave should be regular workplace entitlement, report urges",2015 aug 20
Former Nauru guard says he saw aftermath of waterboarding,2015 aug 20
Unions line up in fight to remove Dyson Heydon at royal commission hearing,2015 aug 20
Dutton confirms seven men on way to Middle East intercepted in Sydney – as it happened,2015 aug 20
Tony Abbott accuses Labor of 'xenophobic games' over free trade deal – video,2015 aug 20
"Tony Abbott changes mind, supports Indigenous meetings on recognition",2015 aug 20
Climate stance of Australian politicians 'disturbing' – US Geological Survey chief,2015 aug 20
"Banks have treated our housing market like a Ponzi scheme, and it's about to bust",2015 aug 20
"Dyson Heydon will continue to lead royal commission, Josh Frydenberg says",2015 aug 20
Victorian Liberal party furious as more than $1m goes missing in alleged fraud,2015 aug 20
AFR editor blames 'erratic' transgender military officer for Mark Latham row,2015 aug 21
Federal chief Brian Loughnane drawn into row over Victorian Liberal accused of theft,2015 aug 21
Abbott government's zeal for political hyperbole makes facts dispensable,2015 aug 21
"Tony Abbott wrong on costs of tougher climate targets, government modelling shows",2015 aug 21
Dyson Heydon likely to make decision on royal commission role by Tuesday,2015 aug 21
Bill Shorten says Canning byelection is a chance to tell Abbott 'enough is enough',2015 aug 21
Joe Hockey's tax disclosure wind-back is a 'reform' nobody asked for,2015 aug 21
Dyson Heydon considers commission future after union submissions – as it happened,2015 aug 21
Asylum seeker allegedly raped on Nauru flown to Australia for treatment,2015 aug 21
Mark Latham in foul-mouthed tirade at Melbourne writers festival,2015 aug 22
Liberal byelection candidate Andrew Hastie defends Afghanistan actions,2015 aug 22
Liberal byelection candidate Andrew Hastie linked to Taliban investigation,2015 aug 22
Bill Shorten says government 'crab walking' away from NDIS,2015 aug 22
Labor cautious over Australia joining air operation against Isis in Syria,2015 aug 22
"Rich pay too much, says Joe Hockey, laying ground for income tax cuts",2015 aug 23
Tony Abbott to visit Eddie Mabo's grave during Torres Strait Islands trip,2015 aug 23
Farmers ​question 'coincidental' timing of proposed environment law change,2015 aug 23
Tony Abbott: welfare card will help lift Indigenous people 'by their bootstraps',2015 aug 23
Tony Abbott to spend at least a week weighing up Isis Syria campaign,2015 aug 23
Julie Bishop says Liberals will watch WA byelection amid leadership questions,2015 aug 23
"'This is a correction, not a crisis,' says Joe Hockey, after share-market rout",2015 aug 24
ABC raises ire of Coalition again after crude tweet about Abbott flashes during Q&A,2015 aug 24
Bill Shorten's approval rating improves as Coalition slides further in Newspoll,2015 aug 24
Former ACTU leader Martin Ferguson backs unions royal commission,2015 aug 24
Tony Abbott says 'it's OK to be gay' but insists same-sex marriage is not OK,2015 aug 24
"Joe Hockey's budget emergency, brought to you by playdough and an old shoe box",2015 aug 24
Clive Palmer stars in bizarre Peanut Butter Jelly parody for hit92.9 radio – video,2015 aug 24
Wayne Swan blasts meagre debate on reform and short-term business policies,2015 aug 24
The world has noted Australia's lack of ambition on climate change,2015 aug 24
Tony Abbott praises Eddie Mabo for 'having a go' on visit to Torres Strait,2015 aug 24
What would an ordinary hypothetical person think of Dyson Heydon?,2015 aug 24
Tony Abbott: I want to see Indigenous challenges for myself – video,2015 aug 24
You're crazy if you believe Labor's emission cuts would cost $600bn,2015 aug 24
"Poll puts Liberals in trouble in Canning byelection, with parties neck and neck",2015 aug 25
Crossbench senators refuse to meet Christopher Pyne's education negotiator,2015 aug 25
"Mark Latham, the Labor leader who crashed, burned – then exploded again",2015 aug 25
Labor and Greens oppose government adding GST to health services,2015 aug 25
Tony Abbott declares trade union inquiry 'must and will go on',2015 aug 25
Canning byelection: solar industry urges voters to reject Liberals 'war on solar',2015 aug 25
Q&A: apparently the most dangerous show on Australian television,2015 aug 25
"Eddie Mabo's legacy reminds us that this is Aboriginal land, and you are welcome too",2015 aug 25
Labor takes aim at Malcolm Turnbull as NBN cost blows out by $15bn,2015 aug 25
Q&A's Tony Abbott outrage: how a lewd tweet made it on to TV – video,2015 aug 25
ABC chief Mark Scott apologises to Tony Abbott over crude tweet on Q&A,2015 aug 25
Naomi Klein on climate change: 'I thought it best to write about my own raw terror',2015 aug 26
Julia Gillard changes her mind to back gay marriage and lambasts Abbott plan,2015 aug 26
"Australian republic: time for 'high-brow worthiness' over, says Peter FitzSimons",2015 aug 26
Bill Shorten open to 'collaborative' industrial relations reform,2015 aug 26
US environmental agency advising Australia on impact of fracking on water,2015 aug 26
"Australia has ‘moral obligation’ to join fight against Isis in Syria, says Bob Carr",2015 aug 26
Dyson Heydon again delays ruling on union commission amid tip-off claims,2015 aug 27
Eric Abetz says he did not know details of Damien Mantach's Tasmania debts,2015 aug 27
Syria combat missions: Kevin Andrews calls for more detail on protecting pilots,2015 aug 27
Victory at The Block: government gives $5m to homes for Aboriginal families,2015 aug 27
Pyne takes swipe at leaking of talk with Abbott about marriage equality,2015 aug 27
Migrants should not have constitutional recognition alongside first Australians,2015 aug 27
Citizenship stripping report put off again after laws described as 'unfit',2015 aug 27
The vaguely Soviet overtones of the reform summit give us a right to be cynical,2015 aug 27
China free trade agreement: Andrew Robb open to constructive talks with Labor,2015 aug 27
China’s slumping economy a bigger threat to Australia than its plunging stock market,2015 aug 27
Abbott says republic a long way off as he defends Australia's political 'maturity',2015 aug 27
Ted Noffs Foundation chief to take ice users to confront Scott Morrison,2015 aug 28
"After 20 years, Australia's gun control debate is igniting once again",2015 aug 28
Wilson Security guards handcuffed asylum seeker boy on Nauru as a 'joke',2015 aug 28
What would Howard do? How Tony Abbott could salvage China trade deal,2015 aug 28
"Citizens of Melbourne, Border Force is concerned for your safety",2015 aug 28
Australian Border Force blames farcical events in Melbourne on 'low level' official – live,2015 aug 28
Former Victorian premier Denis Napthine to quit politics after 27 years,2015 aug 28
Tasmanian Liberals forced to apologise over money repaid by Damien Mantach,2015 aug 28
Protest in Melbourne forces Australian Border Force to cancel visa crackdown – video,2015 aug 28
F is for farce: how Australian Border Force united the nation against it,2015 aug 28
Chaos in Melbourne as protests force border force to cancel visa operation,2015 aug 28
Coalition puts more pressure on Labor to back China-Australia free trade deal,2015 aug 28
Tony Abbott welcomes Bob Hawke's support for China free trade deal – video,2015 aug 28
Tony Abbott's tour of the Torres Strait Islands and Cape York – in pictures,2015 aug 28
Don't believe the hype. Coal employs fewer people than McDonald's,2015 aug 28
Bill Shorten says Labor won't back off over China trade deal negotiations,2015 aug 29
Tony Abbott says border force announcement was 'over the top',2015 aug 29
Cambodia deal doomed after just four Nauru refugees resettled for $55m,2015 aug 30
Tony Abbott says trade union inquiry will continue with or without Heydon,2015 aug 30
Industry Super ad campaign opposes push to change default fund rules,2015 aug 30
Border force announcement went to Peter Dutton's office twice before release,2015 aug 30
"No need to change China trade deal to address job fears, say Australian unions",2015 aug 30
Peter Dutton says Fairfax 'trying to bring the government down',2015 aug 31
Naomi Klein tells Q&A: Australians should rise up in protest over Nauru detainees,2015 aug 31
"'People care about local issues, not Tony Abbott': why Canning's voters are wary of Canberra",2015 aug 31
He's staying! No-bias Dyson Heydon slices his reasons deli-thin,2015 aug 31
Border force launches internal review in wake of 'badly worded' press release,2015 aug 31
Dyson Heydon rejects call to disqualify himself from union royal commission,2015 aug 31
"All children should be removed from Nauru detention, Senate inquiry finds",2015 aug 31
