"Ian Macfarlane is 'gaming the system' with defection to Nationals, says Liberal",2015 dec 04
Labor says Greens are 'selling out' with tax transparency deal – video,2015 dec 04
"I have given no commitments to Ian Macfarlane, says Warren Truss – video",2015 dec 04
"Liberals hold on to Joe Hockey's old seat in byelection, despite 13% swing",2015 dec 05
Julie Bishop chided for 'joke' about rising seas flooding Marshall Islands,2015 dec 05
Australia isolated as developed nations cancel carryover credits from Kyoto,2015 dec 05
Nationals dismiss claims Macfarlane offered to stay in Liberals in return for cabinet spot,2015 dec 05
Ed Husic: Why I'm cheering on the innovation liberation,2015 dec 06
UN called for asylum seeker Sayed Abdellatif's release six months ago,2015 dec 06
Indigenous recognition: Patrick Dodson and Mark Leibler to lead council,2015 dec 06
Malcolm Turnbull's innovation package  offers tax breaks and school focus,2015 dec 06
Shorten unveils 'tough' union governance measures ahead of royal commission,2015 dec 06
Teenager dead and two in hospital after Adelaide Stereosonic music festival,2015 dec 06
Health sector applauds $300m ice prevention and treatment plan,2015 dec 06
Brandis accuses Macfarlane of 'gaming the system' in defection to Nationals,2015 dec 06
Labor questions appointment of Joe Hockey as Australia's ambassador to the US,2015 dec 07
They blinded me with science ... but where's the rub?,2015 dec 07
Stan Grant: 'Black Australia is a foreign place and I feel like a foreign correspondent in my own land',2015 dec 07
"Malcolm Turnbull's popularity dips in poll, as Bill Shorten slumps to fresh low",2015 dec 07
"For Sayed Abdellatif, the mental scars of detention add insult to injury",2015 dec 07
My wedding day was the happiest of my life. Why did it have to be outside Australia?,2015 dec 07
Julie Bishop's Marshall Islands remark: 'I'm not Tanya Plibersek's subeditor',2015 dec 07
Julie Bishop says Australia will reward 'innovation' to tackle climate change,2015 dec 07
Former treasurer Joe Hockey set to be named US ambassador,2015 dec 07
$1.1bn innovation package aims to bridge gap between public and private,2015 dec 07
Australia considers legal action against Japan's decision to resume whaling,2015 dec 07
Malcolm Turnbull on innovation: 'This is the opportunity of the 21st century'– video,2015 dec 07
Innovation statement: startups 'free to fail' in bid to encourage risk-taking,2015 dec 07
The National Ice Action Plan is a setback to all that has been achieved in drug policy,2015 dec 07
"Tony Abbott, you do know you belong to a church that has not reformed, don't you?",2015 dec 08
Torres Strait Islanders on ‘the trauma of climate change in the land of our ancestors’ – video,2015 dec 08
Turnbull to review GST options with state premiers in bid to raise $45bn,2015 dec 08
"Tony Abbott says political future not ‘entirely resolved’, but hints he will stay in parliament",2015 dec 08
Exclusive footage of fridge later bought by Tony Abbott on Gumtree – video,2015 dec 08
Australia's shameful treatment of Sayed Abdellatif,2015 dec 08
Julie Bishop says she is not Tanya Plibersek's subeditor – video,2015 dec 08
Leigh Sales stops Malcolm Turnbull’s interview role-reversal on 7.30 program – video,2015 dec 08
Julie Bishop mocks Tanya Plibersek over Marshall Islands climate change claims  – video,2015 dec 08
Hundreds of CFMEU members rally for Victorian union officials facing charges,2015 dec 08
"Omar Musa, Hau, L-Fresh the Lion and Lior: The Past Becomes You – video premiere",2015 dec 08
"Thanks to Mal Brough, Turnbull can no longer cast himself as the anti-politician",2015 dec 08
"Australia signs up for clear carbon trading rules, hinting at policy change",2015 dec 09
"GST 15% rise would hit lowest earners hardest, latest modelling shows",2015 dec 09
"Translate Australian road signs to lure Chinese travellers, says tourism minister",2015 dec 09
Clive Palmer's Queensland Nickel to stand trial over alleged toxic leaks,2015 dec 09
"Australia's offshore detention cost $1.2bn in 2014-15, Senate estimates told",2015 dec 09
A GST on fresh food is an exceptionally dumb strategy in the midst of an obesity crisis,2015 dec 09
Labor compares Abbott to Trump as Turnbull rebukes former PM for attack on Islam,2015 dec 09
Melbourne East West Link audit finds project cost taxpayers $1bn,2015 dec 09
The ABC doesn't need Andrew Bolt to debate Indigenous recognition,2015 dec 09
Tony Abbott: I still have a contribution to make to public life – video,2015 dec 09
Terrorism offenders could face extra jail time under new proposals,2015 dec 10
Clive Palmer's claims not to be company director contradicted by documents,2015 dec 10
Scott Morrison will not raise GST to fund states' funding black holes,2015 dec 10
Bill Shorten says Tony Abbott 'a very unusual man' who tarnishes Australia,2015 dec 10
Barnaby Joyce rejects call to toughen laws on export of greyhounds,2015 dec 10
Malcolm Turnbull's big test in an age of coup culture and disenchantment,2015 dec 11
Proposal to keep terrorists in jail indefinitely given green light,2015 dec 11
Clive Palmer and Campbell Newman to go to mediation over defamation dispute,2015 dec 11
Bill Shorten will be fined by Victoria police over texting and driving incident,2015 dec 11
Bill Shorten caught on camera texting while driving in Melbourne – video,2015 dec 11
Paris climate talks: Bishop hails 'historic' day as nearly 200 countries sign deal,2015 dec 12
Paris climate deal might just be enough to start turning the tide on global warming,2015 dec 12
What does the Paris climate agreement mean for Australia?,2015 dec 12
Ian Macfarlane's decision to switch to Nationals endorsed by his LNP branch,2015 dec 12
"John Bannon, former premier of South Australia, dies aged 72",2015 dec 13
Clive Palmer hits out at Queensland treasurer over refusal to bail out nickel refinery,2015 dec 13
Malcolm Turnbull lifts Abbott ban on government finance for wind power,2015 dec 13
Tanya Plibersek: Australia deserves a seat at the table in Syria negotiations,2015 dec 14
Ian Macfarlane: 'I'm not ready to retire from politics' – video,2015 dec 14
Life lessons with Malcolm Turnbull: master listening and self-awareness,2015 dec 14
Scathing report damns Abbott’s handling of East West Link funds,2015 dec 14
New bill could change the way control orders work and keep evidence secret,2015 dec 14
LNP blocks Ian Macfarlane's bid to defect from Liberals to Nationals,2015 dec 14
Greg Hunt says overseas emissions credits will 'probably' be allowed,2015 dec 14
"Taxpayers shell out $1,700 for three beanbags for Julie Bishop's creativity initiative",2015 dec 14
The politics of identity: We are trapped in the imaginations of white Australians,2015 dec 14
Q&A should be simulcast live on ABC News 24 for national audience – report,2015 dec 14
Liberal senator warns against Abbott's 'simplistic' call for reformation in Islam,2015 dec 15
Tony Abbott's 'green army' under attack as Coalition cuts budget by nearly half,2015 dec 15
Myefo: Scott Morrison reveals budget deficit to blow out by $26bn over four years – politics live,2015 dec 15
Myefo: budget banks on 'unrealistic' $13.9bn savings blocked by Senate,2015 dec 15
Myefo papers indicate lifeline for Australian information commission,2015 dec 15
"Myefo: bulk-billing rules 'Tony Abbott's GP co-payment in disguise', says AMA",2015 dec 15
Scott Morrison: ‘We are not going to take detours or shortcuts’ – video,2015 dec 15
"What a turn-up for the books: a big spending, big taxing Liberal party",2015 dec 15
"Darwin port deal with Chinese group poses no threat, says defence official",2015 dec 15
"Malcolm Turnbull's stocks remain high, but his coffers are increasingly empty",2015 dec 15
Myefo: key points at a glance,2015 dec 15
Myefo: Scott Morrison says budget will blow out by $26bn over four years,2015 dec 15
Ian Macfarlane ponders future after LNP stonewalls move to defect to Nationals,2015 dec 15
NT government assets privatised without knowing where proceeds will go,2015 dec 16
Myefo: government defends welfare-fraud savings in economic outlook,2015 dec 16
Malcolm Turnbull's flying visit to Japan to include 'special time' with Shinzo Abe,2015 dec 16
Malcolm's NBN innovation: from helpful and important to ferret underpants,2015 dec 16
Senate inquiry calls for easier credit card switching and minimum repayments,2015 dec 16
Labor MP Anna Burke to quit politics in 2016 ‘before I resent doing a job I love’,2015 dec 16
Australian delegation asked 'rude' questions during 'explosive' West Bank meeting,2015 dec 16
"Greens are the most likely voters to dislike Christmas, says poll",2015 dec 16
The sound and fury of Icac: surely it can't get any more theatrical than this?,2015 dec 16
Co-payment for pathology services 'only option' as industry seeks urgent meeting,2015 dec 17
Adoption at all-time low in Australia 'because of focus on family reunion',2015 dec 17
Sussan Ley concedes some patients will pay more with new bulk-billing rules,2015 dec 17
"Government can grant protection visa but refuse refugee's family, court finds",2015 dec 17
"ABC’s Q&A program should give women proper representation, says report",2015 dec 17
"Tax transparency: search the full list of 1,539 companies",2015 dec 17
MPs question Asio chief’s request to moderate language on Islam,2015 dec 17
Malcolm Turnbull tells Shinzo Abe he's disappointed about whaling resumption,2015 dec 18
"Islamic State's defeat by Iraqi forces just a matter of time, says top navy official",2015 dec 18
Australian politics year in review 2015 – an enormous lower intestine of a year,2015 dec 18
Malcolm Turnbull slaps down MPs' criticism of Asio chief over Islam advice,2015 dec 18
"The government's cultural barbarism and plunder of the arts, continued",2015 dec 18
"Australian bikie refused entry to New Zealand, prompting talk of diplomatic retaliation",2015 dec 18
"A year in Australian politics: after a steady drumbeat of fear, 2015 ends on hopeful note",2015 dec 18
Niece of federal MP Cathy McGowan faces court over alleged election fraud,2015 dec 18
"Tony Abbott should quit parliament, voters in his electorate tell pollsters",2015 dec 19
The stoner sloth campaign is genius – if it's intended for people who already hate marijuana,2015 dec 20
Christopher Pyne privately lobbies radio host to help stop Xenophon candidate,2015 dec 20
'Stoner sloth' stars in bizarre anti-cannabis ad from NSW government – video,2015 dec 20
Australians caught up in Paris attacks entitled to financial help,2015 dec 20
Government to subsidise hepatitis C treatment in effort to eradicate disease,2015 dec 20
Tony Abbott hints he'll stay in politics despite calls from electorate to quit,2015 dec 20
Stepping out from the shadows: how domestic violence caught the nation’s attention in 2015,2015 dec 21
"Sunday penalty rates should be cut in certain sectors, report recommends",2015 dec 21
Indonesian police hunt for more suspects over foiled terrorist attacks,2015 dec 21
"Under the guiding stars of struggle and hope, we can have a truly inclusive ideas boom",2015 dec 22
2015: the year it became exciting to be alive ... apparently,2015 dec 22
"George Brandis must process Labor request to see parts of his diary, tribunal rules",2015 dec 22
The hidden nasties of the Productivity Commission review (and some gems),2015 dec 22
Abbot Point coal terminal expansion given approval by Greg Hunt,2015 dec 22
"Public transport, private owners – the unexamined trajectory of privatisation",2015 dec 23
I'm dreaming of a black Christmas – the only real Christmas I have known,2015 dec 23
"David Marr's review of 2015: terror fears and shark scares, but Australia carried on regardless",2015 dec 23
"Most Australians want customs ship to monitor Japanese whaling, poll finds",2015 dec 23
"The song of the year urged us to let it flow. Instead, we pushed back",2015 dec 24
Mamamia editor Jamila Rizvi confirms she wants to stand for parliament,2015 dec 24
Bill Shorten's Christmas message – video,2015 dec 24
Malcolm Turnbull's Christmas message – video,2015 dec 24
Malcolm Turnbull gets a warm welcome at Wayside Chapel Christmas party,2015 dec 25
"Mike Bowers: spills, bills and Choppergate. Australia's political year – in pictures",2015 dec 25
"Australia's carbon emissions are increasing, government report shows",2015 dec 26
Guardian Australia's quiz of the year: Australian politics in 2015,2015 dec 27
"Malcolm Turnbull out of touch on Sunday penalty rates, says Labor",2015 dec 27
Labor overhauls social policy – with a little help from Tony Abbott,2015 dec 28
Sussan Ley lists 23 Medicare items for review as funding overhaul begins,2015 dec 28
The ABC is like a victim trapped in an abusive relationship – with the government,2015 dec 28
Witnesses in Christmas Island class action exempt from Border Force Act secrecy provisions,2015 dec 28
Australian minister resigns over 'informal' behaviour towards public servant at Hong Kong bar – video,2015 dec 29
Malcolm Turnbull loses two ministers but the stench of one could linger,2015 dec 29
"Timing of Turnbull ministers' departure 'shocking cynicism', says Labor",2015 dec 29
"It's a no-brainer – if you want school funding to be needs-based, fund Gonski",2015 dec 29
An Australian politician walks into a bar … and things don't always go well,2015 dec 29
Mal Brough steps aside as minister while police investigate Slipper affair,2015 dec 29
Jamie Briggs resigns as minister over incident in Hong Kong bar with female public servant,2015 dec 29
'Tragedy and triumph': Turnbull pays tribute to Victoria's Christmas Day firefighters,2015 dec 29
Malcolm Turnbull willing to ‘fight an election’ on industrial relations,2015 dec 30
Malcolm Turnbull rules out return of Tony Abbott in cabinet reshuffle,2015 dec 30
Eric Abetz calls for Abbott to be returned to cabinet after ministers' departure,2015 dec 30
"The hits, the misses and the zealous overreach of the trade union royal commission",2015 dec 30
"Final trade union royal commission report condemns 'louts, thugs, bullies, thieves'",2015 dec 30
"Kezia Purick: 'Some say I'm to the right of Genghis Khan, which is OK by me'",2015 dec 31
Forewarned is forearmed: three factors that will drive right-wing politics in 2016,2015 dec 31
Graduates who move overseas to be forced to pay back student debts,2015 dec 31
Cabinet papers 1990-91: Paul Keating's press clippings show growing frustration,2015 dec 31
Cabinet papers 1990-91: Hawke's fight to keep mining out of Kakadu helped unseat him,2015 dec 31
Cabinet papers 1990-91: Labor wrestled with rising asylum claims,2015 dec 31
"Bob Hawke looks back: former PM on his feud with Keating, leadership and reform",2015 dec 31
Unions vow to fight after PM says industrial relations high on election agenda,2015 dec 31
"After taking out the trash this week, Malcolm Turnbull is missing in action",2015 dec 31
End ‘nanny state’ fireworks ban and bring back cracker night: Leyonhjelm,2015 dec 31
Mal Brough may lose his job over Ashbygate. He should have lost it over the intervention,2015 dec 31
Knights and dames removed from Order of Australia by Malcolm Turnbull,2015 nov 01
Labor says Australia must 'tell story of Pacific to world' at Paris climate talks,2015 nov 01
Coalition asks miners and coal seam gas firms to respect farmers' 'moral rights',2015 nov 01
Coalition proposes reducing childcare payments to rich families,2015 nov 01
Victoria byelections: Liberals win one but may lose Denis Napthine's old seat,2015 nov 01
Gas companies treated staff at industry regulator to cocktail parties and ballet,2015 nov 02
"Julie Bishop breaks cover on marriage equality, saying she has 'no concerns'",2015 nov 02
"Q&A: mining will turn Australia into a third-world country, says ecologist Paul Ehrlich",2015 nov 02
'Republicanism by stealth': monarchists wary of removal of dames and knights,2015 nov 02
Malcolm Turnbull: knights and dames are not appropriate in 2015 – video,2015 nov 02
Malcolm Turnbull is everything Australia ever wanted,2015 nov 02
"Fruity royal titles went rancid years ago. Please, let this be the end of them",2015 nov 02
Scott Morrison welcomes 15% GST proposal but stops short of endorsing it,2015 nov 02
What if Aboriginal people helped all Australians to connect to country?,2015 nov 02
Peter Dutton: Jordan refugee camp visit 'reinforces belief' in tough border policy,2015 nov 03
Australian Border Force staff stood down without pay over pay dispute,2015 nov 03
ABC spent nearly $50m on redundancy payouts after Coalition budget cuts hit,2015 nov 03
Reserve Bank of Australia keeps cash rate at 2% – as it happened,2015 nov 03
Reserve Bank keeps cash rate on hold but leaves door open for a cut,2015 nov 03
Julie Bishop: I have no concerns over same-sex marriage – video,2015 nov 03
There's no reporting on Asio operations when even the watchdog won't talk,2015 nov 03
Malcolm Turnbull on tax reform: vulnerable Australians will not be disadvantaged – video,2015 nov 03
No action for a year on mental health reform? Australians deserve better,2015 nov 04
Reducing carbon emissions now will safeguard Australian way of life – report,2015 nov 04
Muslims feel inadequately protected by the Racial Discrimination Act – report,2015 nov 04
Raising GST to 15% 'will cost poorest families 7% of disposable income',2015 nov 04
Australian Electoral Commission warned over failure to enrol 1.2m voters,2015 nov 04
The politics of dancing: world leaders show off their not-so-smooth moves,2015 nov 04
NAB 'covered its backside' while small firms went to the wall – Doug Cameron,2015 nov 04
David Leyonhjelm's 'all cops are bastards' comments 'appalling' – police,2015 nov 04
"I chose democracy, having lived the alternative. Those attracted to extremism chose, too",2015 nov 04
Most Coalition voters do not believe in human-induced climate change – CSIRO,2015 nov 04
Bill Shorten hits the dancefloor in Kiribati – video,2015 nov 04
Raising the GST is pointless if done to cut taxes on the rich,2015 nov 05
Andrew Robb defends TPP after full release of trade deal document,2015 nov 05
Mark Dreyfus vs George Brandis: battle over access to the minister’s diary,2015 nov 05
Labor national executive overrides state branch to allow MPs to contest WA seats,2015 nov 05
Facial recognition database would give police ‘unprecedented’ access,2015 nov 05
We're obsessed with 'no platforming' but aren't resisting the return of harder censorship,2015 nov 05
"Lobbyist tells widow at gun control rally: A 'bad man' killed your husband, not a gun",2015 nov 05
Malcolm Turnbull: 'burden of tax is best borne by those able to pay it',2015 nov 05
Peter Dutton: Leyonhjelm's 'bastard cops' comments a slap in the face,2015 nov 05
Climate summit held by business and green groups to end six-year policy war,2015 nov 06
When is a budget cut not a saving? When we can no longer afford the essentials,2015 nov 06
Pregnant asylum seekers: Labor says medical advice should trump policy,2015 nov 06
"Malcolm Turnbull is to blame for $15bn NBN cost blowout, says Labor",2015 nov 06
Julia Gillard defends hardline asylum seeker policy in al-Jazeera interview,2015 nov 06
Bill Shorten considers capital gains and fringe benefits tax in spirit of 'fairness',2015 nov 06
"The Coalition can try to 'sell' a GST increase, but Australians won't buy it",2015 nov 06
Arts minister promises to ditch Brandis-style 'out of the blue' funding changes,2015 nov 06
Freedom of information: George Brandis’s diary has its day in court,2015 nov 06
"Coal not so 'amazing', public say, as mining industry advertising backfires",2015 nov 06
"Call me emotional, but my anti-nuclear arguments are based on evidence",2015 nov 06
"Justin Trudeau's cabinet reminds Australia of its old, white, male politics",2015 nov 06
"Carbon tax more affordable than GST hike to raise same revenue, say Greens",2015 nov 07
Trade unions inquiry defends timing of late-night release clearing Bill Shorten,2015 nov 07
Membership figures don't tell the whole story about the union movement's value,2015 nov 07
Bill Shorten's lawyers rebuke unions inquiry for not warning him of release,2015 nov 08
"Coalition launches private health cover survey, setting sights on 'junk' policies",2015 nov 08
Former ALP treasurer: royal commission has left party with 'egg on their face',2015 nov 08
International passengers face delays on Monday as border force staff strike,2015 nov 08
Peter Dutton: Australia could take more Syrian and Iraqi refugees,2015 nov 08
Bill Shorten says aged care and disability workers need long service leave scheme,2015 nov 08
UN countries line up to criticise Australia's human rights record,2015 nov 09
Coalition locks in commanding poll lead on back of Malcolm Turnbull's appeal,2015 nov 09
Turnbull government weighs increasing contribution to Green Climate Fund,2015 nov 09
"Indigenous constitutional recognition: public awareness has risen, poll shows",2015 nov 09
Australian government says Christmas Island is calm after riots,2015 nov 09
Natasha Stott Despoja launches anti-violence guidelines,2015 nov 09
David Leyonhjelm: I didn’t call 'all cops bastards' – video,2015 nov 09
Senate defeats motion claiming ban on abortion protest is attack on free speech,2015 nov 09
Private health insurance survey: what does it mean for Australian healthcare?,2015 nov 09
Dutton: 'No suspicious circumstances' around refugee's death' – as it happened,2015 nov 09
Christmas Island detainees fear retribution following unrest over death of escapee,2015 nov 09
'Real Australians' are a myth and 'saying welcome' to refugees is not enough,2015 nov 09
Doug Cameron: government 'seems incapable' of operating detention centres – video,2015 nov 09
Conservation group challenges approval of Carmichael coalmine as ‘illegal’,2015 nov 09
Craig Thomson tells court he cannot afford fine for misuse of union funds,2015 nov 09
Australia must not be afraid of its obligations to Pacific climate migrants,2015 nov 10
Progressive Australia's infatuation with Malcolm Turnbull will only end in heartbreak,2015 nov 10
Labor to 'thoroughly' examine bill to strip dual nationals' citizenship,2015 nov 10
Australia's lavish spending on Anzac memorials cloaks a more distasteful reality,2015 nov 10
Kevin Rudd slams George Pell as 'radical climate sceptic' ahead of Paris talks,2015 nov 10
Peter Dutton says most Christmas Island detainees are serious criminals – as it happened,2015 nov 10
Aboriginal activist who refused to vote for cultural reasons has fine quashed,2015 nov 10
"Northern Australia has to promote itself to Asia, investment forum hears",2015 nov 10
Law to strip dual nationals of Australian citizenship set to pass parliament,2015 nov 10
Christmas Island detention centre 'under control' after riot police move in,2015 nov 10
Terminal cancer patient tells Q&A: ‘I want the comfort of knowing I can end my life' – video,2015 nov 10
Australia's civic life will suffer if the major parties turn universities into factories,2015 nov 10
Peter Dutton on Christmas Island riots: priority is to 'restore order' – video,2015 nov 10
Labor knockback on family payment cuts forces Coalition to go back to crossbench,2015 nov 10
Melissa Parke: Labor cannot support the deliberate cruelty of current asylum seeker policy,2015 nov 11
Annabel Crabb: 'I don’t make Kitchen Cabinet so you can love it',2015 nov 11
Coal from Carmichael mine 'will create more annual emissions than New York',2015 nov 11
Senate setback offers Coalition an ultimatum on multinational tax changes,2015 nov 11
Senate passes tax avoidance bill targeting multinationals  – as it happened,2015 nov 11
Public service ordered to increase number of Indigenous staff,2015 nov 11
Labor demands time to go through citizenship laws in depth before debate,2015 nov 11
Malcolm Turnbull's Jakarta visit to focus on trade and economic ties,2015 nov 11
Prince Charles and Camilla join Malcolm Turnbull for Remembrance Day,2015 nov 11
Kevin Rudd calls for bipartisan support for Indigenous recognition,2015 nov 11
Is Australia the last country standing in defence of coal?,2015 nov 11
Market forces help Turnbull to build warmer relations with Indonesia,2015 nov 12
"Forget marriage equality, praise David Cameron for tough calls – Tony Abbott",2015 nov 12
Citizenship bill still vulnerable to high court challenge – constitutional lawyers,2015 nov 12
"Prince Charles exudes divine right to rule, but apathy may be his saving grace",2015 nov 12
New Zealand soldier who was PM's bodyguard faces deportation from Australia,2015 nov 12
Malcolm Turnbull says 'outstanding' Julie Bishop has his '110% confidence',2015 nov 12
Malcolm Turnbull says Julie Bishop has his '110% confidence' – as it happened,2015 nov 12
"Tropfest in doubt: proof that without arts funding, the industry is in peril",2015 nov 12
Greens and Labor thwart Eric Abetz anti-marriage equality booklet motion,2015 nov 12
Carbon abatement: government spends another $557m to buy 45m tonnes,2015 nov 12
Protecting tax privacy for the uber-rich is a strange thing to take a stand on,2015 nov 12
Malcolm Turnbull arrives in Indonesia on mission to heal relationship,2015 nov 12
Julie Bishop denies plotting to oust Tony Abbott – video,2015 nov 12
Briton who has lived in Australia for 50 years faces deportation for scrub fire,2015 nov 12
Scott Morrison sets up a showdown with Senate over tax avoidance bill,2015 nov 12
The Weekly Beast: sifting truth from spin in Chris Kenny’s trip to Nauru,2015 nov 12
Julie Bishop defends herself against allegations of treachery against Tony Abbott,2015 nov 12
Closed doors and troubled minds: the anguish of Christmas Island's detention centre,2015 nov 12
"How Barrie Cassidy, the ultimate Insider, charmed his way to number one",2015 nov 13
Malcolm Turnbull grips the zeitgeist in his Berlin whirl,2015 nov 13
